{
  "schema_version": "1.0",
  "event_id": "entrance-camera:main-entrance:track-8291:2026-09-22T10:42:18.381Z",
  "observed_at": "2026-09-22T10:42:18.381Z",
  "camera_id": "entrance-camera",
  "line_id": "main-entrance",
  "line_name": "Main entrance",
  "direction": "in",
  "track_id": "8291",
  "crossing_point": {"x": 0.47, "y": 0.62},
  "vehicle": {
    "class": "car",
    "confidence": 0.94,
    "bbox": {"x1": 211, "y1": 173, "x2": 491, "y2": 422}
  }
}
